{
  "$schema": "https://json-schema.org/draft/2020-12/schema", "$id": "https://serviceos.example/schemas/events/service-assignment-activation-abort-completed-v1.schema.json", "title": "ServiceAssignmentActivationAbortCompletedV1", "type": "object", "additionalProperties": false,
  "required": ["eventId", "eventType", "schemaVersion", "tenantId", "correlationId", "causationId", "aggregateType", "aggregateId", "aggregateVersion", "occurredAt", "payload"],
  "properties": {"eventId": {"type": "string", "format": "uuid"}, "eventType": {"const": "service.assignment.activation-abort-completed"}, "schemaVersion": {"const": 1}, "tenantId": {"type": "string"}, "correlationId": {"type": "string"}, "causationId": {"type": "string"}, "aggregateType": {"const": "ServiceAssignment"}, "aggregateId": {"type": "string", "format": "uuid"}, "aggregateVersion": {"const": 4}, "occurredAt": {"type": "string", "format": "date-time"}, "payload": {"$ref": "#/$defs/payload"}},
  "$defs": {"payload": {"type": "object", "additionalProperties": false, "required": ["serviceAssignmentId", "sagaId", "workOrderId", "taskId", "responsibilityLevel", "assigneeId", "businessType", "status", "capacityReservationId", "guardId", "preparedTaskAssignmentId", "reasonCode", "occurredAt"], "properties": {"serviceAssignmentId": {"type": "string", "format": "uuid"}, "sagaId": {"type": "string", "format": "uuid"}, "workOrderId": {"type": "string", "format": "uuid"}, "taskId": {"type": "string", "format": "uuid"}, "responsibilityLevel": {"enum": ["NETWORK", "TECHNICIAN"]}, "assigneeId": {"type": "string"}, "businessType": {"type": "string"}, "status": {"const": "FAILED_ACTIVATION"}, "supersedesServiceAssignmentId": {"type": ["string", "null"], "format": "uuid"}, "capacityReservationId": {"type": "string", "format": "uuid"}, "guardId": {"type": "string", "format": "uuid"}, "preparedTaskAssignmentId": {"type": "string", "format": "uuid"}, "reasonCode": {"const": "TASK_ASSIGNMENT_ABORTED"}, "occurredAt": {"type": "string", "format": "date-time"}}}}
}
