{
  "eventId": "c1111111-1111-4111-8111-111111111111", "eventType": "service.assignment.activation-abort-completed", "schemaVersion": 1, "tenantId": "tenant-byd", "correlationId": "corr-m26-abort-complete", "causationId": "idem-m26-abort-complete", "aggregateType": "ServiceAssignment", "aggregateId": "c3333333-3333-4333-8333-333333333333", "aggregateVersion": 4, "occurredAt": "2026-07-14T10:03:00Z",
  "payload": {"serviceAssignmentId": "c3333333-3333-4333-8333-333333333333", "sagaId": "c4444444-4444-4444-8444-444444444444", "workOrderId": "c5555555-5555-4555-8555-555555555555", "taskId": "c6666666-6666-4666-8666-666666666666", "responsibilityLevel": "TECHNICIAN", "assigneeId": "technician-002", "businessType": "SITE_SURVEY", "status": "FAILED_ACTIVATION", "supersedesServiceAssignmentId": "c2222222-2222-4222-8222-222222222222", "capacityReservationId": "c7777777-7777-4777-8777-777777777777", "guardId": "c8888888-8888-4888-8888-888888888888", "preparedTaskAssignmentId": "c9999999-9999-4999-8999-999999999999", "reasonCode": "TASK_ASSIGNMENT_ABORTED", "occurredAt": "2026-07-14T10:03:00Z"}
}
